match,market_name,home_team,home_win,away_team,away_win,margin,agency
Brisbane Bullets v Cairns Taipans,Head To Head,Brisbane Bullets,1.8,Cairns Taipans,2.02,1.051,Bet365
Perth Wildcats v Adelaide 36ers,Head To Head,Perth Wildcats,1.35,Adelaide 36ers,3.25,1.048,Bet365
South East Melbourne Phoenix v New Zealand Breakers,Head To Head,South East Melbourne Phoenix,1.33,New Zealand Breakers,3.35,1.05,Bet365
Illawarra Hawks v Melbourne United,Head To Head,Illawarra Hawks,1.72,Melbourne United,2.15,1.047,Bet365
Sydney Kings v Tasmania JackJumpers,Head To Head,Sydney Kings,1.21,Tasmania JackJumpers,4.5,1.049,Bet365
