match,market_name,home_team,home_win,away_team,away_win,margin,agency
Melbourne United v Sydney Kings,Head To Head,Melbourne United,1.44,Sydney Kings,2.8,1.052,Bet365
Tasmania JackJumpers v South East Melbourne Phoenix,Head To Head,Tasmania JackJumpers,1.5,South East Melbourne Phoenix,2.6,1.051,Bet365
Perth Wildcats v Illawarra Hawks,Head To Head,Perth Wildcats,2.18,Illawarra Hawks,1.7,1.047,Bet365
New Zealand Breakers v Adelaide 36ers,Head To Head,New Zealand Breakers,2.35,Adelaide 36ers,1.6,1.051,Bet365
Cairns Taipans v Brisbane Bullets,Head To Head,Cairns Taipans,2.1,Brisbane Bullets,1.75,1.048,Bet365
