match,start_time,market_name,home_team,home_win,away_team,away_win,margin,agency
Melbourne United v South East Melbourne Phoenix,2023-09-28T09:30:00Z,Head To Head,Melbourne United,1.53,South East Melbourne Phoenix,2.5,1.054,BetRight
Brisbane Bullets v Adelaide 36ers,2023-09-29T09:30:00Z,Head To Head,Brisbane Bullets,1.4,Adelaide 36ers,2.95,1.053,BetRight
Perth Wildcats v Tasmania JackJumpers,2023-09-29T11:30:00Z,Head To Head,Perth Wildcats,1.34,Tasmania JackJumpers,3.2,1.059,BetRight
New Zealand Breakers v Cairns Taipans,2023-09-30T06:30:00Z,Head To Head,New Zealand Breakers,1.4,Cairns Taipans,2.95,1.053,BetRight
Illawarra Hawks v Sydney Kings,2023-09-30T10:00:00Z,Head To Head,Illawarra Hawks,3,Sydney Kings,1.39,1.053,BetRight
