match,start_time,market_name,home_team,home_win,away_team,away_win,margin,agency
Tasmania JackJumpers v Adelaide 36ers,2025-11-13T08:30:00Z,Head To Head,Tasmania JackJumpers,2.6,Adelaide 36ers,1.48,1.06,BetRight
Cairns Taipans v South East Melbourne Phoenix,2025-11-14T08:30:00Z,Head To Head,Cairns Taipans,3.2,South East Melbourne Phoenix,1.33,1.064,BetRight
Melbourne United v Brisbane Bullets,2025-11-15T06:30:00Z,Head To Head,Melbourne United,1.16,Brisbane Bullets,5,1.062,BetRight
Perth Wildcats v New Zealand Breakers,2025-11-15T09:00:00Z,Head To Head,Perth Wildcats,1.44,New Zealand Breakers,2.75,1.058,BetRight
Illawarra Hawks v Sydney Kings,2025-11-16T03:30:00Z,Head To Head,Illawarra Hawks,1.75,Sydney Kings,2.04,1.062,BetRight
