match,start_time,market_name,home_team,home_win,away_team,away_win,margin,agency
Tasmania JackJumpers v Adelaide 36ers,2025-11-13T08:30:00Z,Head To Head,Tasmania JackJumpers,2.45,Adelaide 36ers,1.52,1.066,BetRight
Cairns Taipans v South East Melbourne Phoenix,2025-11-14T08:30:00Z,Head To Head,Cairns Taipans,3.15,South East Melbourne Phoenix,1.34,1.064,BetRight
Melbourne United v Brisbane Bullets,2025-11-15T06:30:00Z,Head To Head,Melbourne United,1.15,Brisbane Bullets,5.25,1.06,BetRight
Perth Wildcats v New Zealand Breakers,2025-11-15T09:00:00Z,Head To Head,Perth Wildcats,1.44,New Zealand Breakers,2.75,1.058,BetRight
Illawarra Hawks v Sydney Kings,2025-11-16T03:30:00Z,Head To Head,Illawarra Hawks,1.75,Sydney Kings,2.04,1.062,BetRight
