match,start_time,market_name,home_team,home_win,away_team,away_win,margin,agency
Cairns Taipans v Illawarra Hawks,2025-11-07T08:30:00.0000000Z,Head To Head,Cairns Taipans,2.5,Illawarra Hawks,1.51,1.062,Betr
Tasmania JackJumpers v Brisbane Bullets,2025-11-08T06:30:00.0000000Z,Head To Head,Tasmania JackJumpers,1.61,Brisbane Bullets,2.25,1.066,Betr
South East Melbourne Phoenix v Melbourne United,2025-11-08T09:00:00.0000000Z,Head To Head,South East Melbourne Phoenix,2.1,Melbourne United,1.7,1.064,Betr
Adelaide 36ers v Perth Wildcats,2025-11-09T03:30:00.0000000Z,Head To Head,Adelaide 36ers,1.44,Perth Wildcats,2.75,1.058,Betr
Sydney Kings v New Zealand Breakers,2025-11-09T05:30:00.0000000Z,Head To Head,Sydney Kings,1.26,New Zealand Breakers,3.75,1.06,Betr
