match,start_time,market_name,home_team,home_win,away_team,away_win,margin,agency
South East Melbourne Phoenix v Sydney Kings,2024-01-25T08:30:00.0000000Z,Head To Head,South East Melbourne Phoenix,6,Sydney Kings,1.12,1.06,Bluebet
Perth Wildcats v Illawarra Hawks,2024-01-25T10:30:00.0000000Z,Head To Head,Perth Wildcats,1.32,Illawarra Hawks,3.3,1.061,Bluebet
New Zealand Breakers v Tasmania JackJumpers,2024-01-26T06:30:00.0000000Z,Head To Head,New Zealand Breakers,1.7,Tasmania JackJumpers,2.1,1.064,Bluebet
Brisbane Bullets v Melbourne United,2024-01-26T08:30:00.0000000Z,Head To Head,Brisbane Bullets,2.75,Melbourne United,1.43,1.063,Bluebet
Adelaide 36ers v Cairns Taipans,2024-01-27T06:30:00.0000000Z,Head To Head,Adelaide 36ers,1.67,Cairns Taipans,2.15,1.064,Bluebet
