match,market_name,home_team,home_win,away_team,away_win,margin,agency
Cairns Taipans v Melbourne United,Head To Head,Cairns Taipans,3.3,Melbourne United,1.3,1.072,Dabble
Illawarra Hawks v Sydney Kings,Head To Head,Illawarra Hawks,5,Sydney Kings,1.14,1.077,Dabble
Perth Wildcats v Brisbane Bullets,Head To Head,Perth Wildcats,1.01,Brisbane Bullets,NA,NA,Dabble
Adelaide 36ers v New Zealand Breakers,Head To Head,Adelaide 36ers,1.15,New Zealand Breakers,4.75,1.08,Dabble
South East Melbourne Phoenix v Tasmania JackJumpers,Head To Head,South East Melbourne Phoenix,1.07,Tasmania JackJumpers,NA,NA,Dabble
