match,market_name,home_team,home_win,away_team,away_win,margin,agency
Melbourne United v Sydney Kings,Head To Head,Melbourne United,1.53,Sydney Kings,2.5,1.054,Dabble
Tasmania JackJumpers v South East Melbourne Phoenix,Head To Head,Tasmania JackJumpers,1.53,South East Melbourne Phoenix,2.5,1.054,Dabble
Perth Wildcats v Illawarra Hawks,Head To Head,Perth Wildcats,2.15,Illawarra Hawks,1.7,1.053,Dabble
New Zealand Breakers v Adelaide 36ers,Head To Head,New Zealand Breakers,2.4,Adelaide 36ers,1.58,1.05,Dabble
Cairns Taipans v Brisbane Bullets,Head To Head,Cairns Taipans,2.1,Brisbane Bullets,1.75,1.048,Dabble
