match,start_time,market_name,home_team,home_win,away_team,away_win,margin,agency
Tasmania JackJumpers v Brisbane Bullets,2024-11-15T08:30:00Z,Head To Head,Tasmania JackJumpers,1.5,Brisbane Bullets,2.6,1.051,Pointsbet
Perth Wildcats v South East Melbourne Phoenix,2024-11-15T10:30:00Z,Head To Head,Perth Wildcats,1.5,South East Melbourne Phoenix,2.6,1.051,Pointsbet
Cairns Taipans v New Zealand Breakers,2024-11-16T06:30:00Z,Head To Head,Cairns Taipans,2.6,New Zealand Breakers,1.5,1.051,Pointsbet
Illawarra Hawks v Sydney Kings,2024-11-16T09:00:00Z,Head To Head,Illawarra Hawks,2,Sydney Kings,1.8,1.056,Pointsbet
Melbourne United v Adelaide 36ers,2024-11-17T05:30:00Z,Head To Head,Melbourne United,1.5,Adelaide 36ers,2.6,1.051,Pointsbet
