match,start_time,market_name,home_team,home_win,away_team,away_win,margin,agency
Tasmania JackJumpers v Illawarra Hawks,2026-02-18T08:30:00Z,Head To Head,Tasmania JackJumpers,1.95,Illawarra Hawks,1.85,1.053,Pointsbet
New Zealand Breakers v Cairns Taipans,2026-02-19T06:30:00Z,Head To Head,New Zealand Breakers,1.7,Cairns Taipans,2.15,1.053,Pointsbet
Melbourne United v South East Melbourne Phoenix,2026-02-19T08:30:00Z,Head To Head,Melbourne United,2.75,South East Melbourne Phoenix,1.45,1.053,Pointsbet
Brisbane Bullets v Sydney Kings,2026-02-20T08:30:00Z,Head To Head,Brisbane Bullets,17,Sydney Kings,1.01,1.049,Pointsbet
Perth Wildcats v Adelaide 36ers,2026-02-20T10:30:00Z,Head To Head,Perth Wildcats,1.77,Adelaide 36ers,2.05,1.053,Pointsbet
