match,start_time,market_name,home_team,home_win,away_team,away_win,margin,agency
Tasmania JackJumpers v Brisbane Bullets,2024-11-15T08:30:00Z,Head To Head,Tasmania JackJumpers,1.45,Brisbane Bullets,2.75,1.053,Pointsbet
Perth Wildcats v South East Melbourne Phoenix,2024-11-15T10:30:00Z,Head To Head,Perth Wildcats,1.62,South East Melbourne Phoenix,2.3,1.052,Pointsbet
Cairns Taipans v New Zealand Breakers,2024-11-16T06:30:00Z,Head To Head,Cairns Taipans,2.4,New Zealand Breakers,1.57,1.054,Pointsbet
Illawarra Hawks v Sydney Kings,2024-11-16T09:00:00Z,Head To Head,Illawarra Hawks,1.85,Sydney Kings,1.95,1.053,Pointsbet
Melbourne United v Adelaide 36ers,2024-11-17T05:30:00Z,Head To Head,Melbourne United,1.55,Adelaide 36ers,2.45,1.053,Pointsbet
