match,market_name,home_team,home_win,away_team,away_win,margin,agency
Melbourne United v Sydney Kings,Head To Head,Melbourne United,1.48,Sydney Kings,2.67,1.05,Sportsbet
Tasmania JackJumpers v South East Melbourne Phoenix,Head To Head,Tasmania JackJumpers,1.5,South East Melbourne Phoenix,2.61,1.05,Sportsbet
Perth Wildcats v Illawarra Hawks,Head To Head,Perth Wildcats,2.23,Illawarra Hawks,1.66,1.051,Sportsbet
New Zealand Breakers v Adelaide 36ers,Head To Head,New Zealand Breakers,2.37,Adelaide 36ers,1.59,1.051,Sportsbet
Cairns Taipans v Brisbane Bullets,Head To Head,Cairns Taipans,2.12,Brisbane Bullets,1.73,1.05,Sportsbet
South East Melbourne Phoenix v Perth Wildcats,Head To Head,South East Melbourne Phoenix,1.89,Perth Wildcats,1.91,1.053,Sportsbet
Sydney Kings v Tasmania JackJumpers,Head To Head,Sydney Kings,1.47,Tasmania JackJumpers,2.69,1.052,Sportsbet
Melbourne United v New Zealand Breakers,Head To Head,Melbourne United,1.4,New Zealand Breakers,2.98,1.05,Sportsbet
