match,market_name,home_team,home_win,away_team,away_win,margin,agency
Cairns Taipans v Brisbane Bullets,Head To Head,Cairns Taipans,1.79,Brisbane Bullets,2.03,1.051,Sportsbet
Illawarra Hawks v Sydney Kings,Head To Head,Illawarra Hawks,1.52,Sydney Kings,2.54,1.052,Sportsbet
Perth Wildcats v Adelaide 36ers,Head To Head,Perth Wildcats,1.43,Adelaide 36ers,2.86,1.049,Sportsbet
Tasmania JackJumpers v Cairns Taipans,Head To Head,Tasmania JackJumpers,1.58,Cairns Taipans,2.39,1.051,Sportsbet
Melbourne United v South East Melbourne Phoenix,Head To Head,Melbourne United,1.79,South East Melbourne Phoenix,2.03,1.051,Sportsbet
