match,market_name,home_team,home_win,away_team,away_win,margin,agency
Adelaide 36ers v Cairns Taipans,Head To Head,Adelaide 36ers,1.35,Cairns Taipans,3.21,1.052,Sportsbet
Perth Wildcats v Sydney Kings,Head To Head,Perth Wildcats,3.29,Sydney Kings,1.34,1.05,Sportsbet
South East Melbourne Phoenix v Illawarra Hawks,Head To Head,South East Melbourne Phoenix,2.87,Illawarra Hawks,1.42,1.053,Sportsbet
Brisbane Bullets v Tasmania JackJumpers,Head To Head,Brisbane Bullets,1.67,Tasmania JackJumpers,2.22,1.049,Sportsbet
Sydney Kings v New Zealand Breakers,Head To Head,Sydney Kings,1.41,New Zealand Breakers,2.92,1.052,Sportsbet
Melbourne United v Cairns Taipans,Head To Head,Melbourne United,1.35,Cairns Taipans,3.21,1.052,Sportsbet
