match,market_name,home_team,home_win,away_team,away_win,margin,agency
Illawarra Hawks v New Zealand Breakers,Head To Head,Illawarra Hawks,1.47,New Zealand Breakers,2.7,1.051,Sportsbet
Cairns Taipans v Sydney Kings,Head To Head,Cairns Taipans,2.76,Sydney Kings,1.45,1.052,Sportsbet
Perth Wildcats v Brisbane Bullets,Head To Head,Perth Wildcats,1.44,Brisbane Bullets,2.81,1.05,Sportsbet
South East Melbourne Phoenix v Illawarra Hawks,Head To Head,South East Melbourne Phoenix,2.06,Illawarra Hawks,1.77,1.05,Sportsbet
Adelaide 36ers v Tasmania JackJumpers,Head To Head,Adelaide 36ers,2.22,Tasmania JackJumpers,1.67,1.049,Sportsbet
Melbourne United v Sydney Kings,Head To Head,Melbourne United,1.36,Sydney Kings,3.17,1.051,Sportsbet
Perth Wildcats v New Zealand Breakers,Head To Head,Perth Wildcats,1.77,New Zealand Breakers,2.06,1.05,Sportsbet
