match,market_name,home_team,home_win,away_team,away_win,margin,agency
Townsville Fire Women v Bendigo Spirit Women,Head To Head,Townsville Fire Women,1.66,Bendigo Spirit Women,2.1,1.079,Sportsbet
Seoul SK Knights v Daegu Pegasus,Head To Head,Seoul SK Knights,1.36,Daegu Pegasus,2.9,1.08,Sportsbet
Changwon LG Sakers v Goyang Skygunners,Head To Head,Changwon LG Sakers,1.3,Goyang Skygunners,3.2,1.082,Sportsbet
Nanjing Monkey Kings v Zhejiang Lions,Head To Head,Nanjing Monkey Kings,3.6,Zhejiang Lions,1.25,1.078,Sportsbet
Liaoning Flying Leopards v Jilin Northeast Tigers,Head To Head,Liaoning Flying Leopards,1.03,Jilin Northeast Tigers,9,1.082,Sportsbet
