match,start_time,market_name,home_team,home_win,away_team,away_win,margin,agency
Melbourne United v South East Melbourne Phoenix,2023-09-28,Head To Head,Melbourne United,1.56,South East Melbourne Phoenix,2.44,1.051,Sportsbet
Brisbane Bullets v Adelaide 36ers,2023-09-29,Head To Head,Brisbane Bullets,1.39,Adelaide 36ers,2.83,1.073,Sportsbet
Perth Wildcats v Tasmania JackJumpers,2023-09-29,Head To Head,Perth Wildcats,1.34,Tasmania JackJumpers,3.06,1.073,Sportsbet
New Zealand Breakers v Cairns Taipans,2023-09-30,Head To Head,New Zealand Breakers,1.36,Cairns Taipans,2.98,1.071,Sportsbet
Illawarra Hawks v Sydney Kings,2023-09-30,Head To Head,Illawarra Hawks,3.06,Sydney Kings,1.34,1.073,Sportsbet
