match,market_name,home_team,home_win,away_team,away_win,margin,agency
New Zealand Breakers v Sydney Kings,Head To Head,New Zealand Breakers,3.62,Sydney Kings,1.29,1.051,Sportsbet
Brisbane Bullets v Cairns Taipans,Head To Head,Brisbane Bullets,1.3,Cairns Taipans,3.56,1.05,Sportsbet
South East Melbourne Phoenix v Adelaide 36ers,Head To Head,South East Melbourne Phoenix,1.65,Adelaide 36ers,2.25,1.051,Sportsbet
Illawarra Hawks v Perth Wildcats,Head To Head,Illawarra Hawks,1.44,Perth Wildcats,2.8,1.052,Sportsbet
Melbourne United v Tasmania JackJumpers,Head To Head,Melbourne United,1.44,Tasmania JackJumpers,2.8,1.052,Sportsbet
