match,market_name,home_team,home_win,away_team,away_win,margin,agency
Melbourne United v Tasmania JackJumpers,Head To Head,Melbourne United,1.39,Tasmania JackJumpers,3.03,1.049,Sportsbet
Perth Wildcats v South East Melbourne Phoenix,Head To Head,Perth Wildcats,1.43,South East Melbourne Phoenix,2.86,1.049,Sportsbet
New Zealand Breakers v Brisbane Bullets,Head To Head,New Zealand Breakers,1.48,Brisbane Bullets,2.67,1.05,Sportsbet
Cairns Taipans v Illawarra Hawks,Head To Head,Cairns Taipans,3.14,Illawarra Hawks,1.37,1.048,Sportsbet
Adelaide 36ers v Sydney Kings,Head To Head,Adelaide 36ers,4.2,Sydney Kings,1.23,1.051,Sportsbet
