match,market_name,home_team,home_win,away_team,away_win,margin,agency
Illawarra Hawks v Brisbane Bullets,Head To Head,Illawarra Hawks,1.42,Brisbane Bullets,2.79,1.063,Sportsbet
Perth Wildcats v Sydney Kings,Head To Head,Perth Wildcats,1.9,Sydney Kings,1.9,1.053,Sportsbet
Cairns Taipans v Adelaide 36ers,Head To Head,Cairns Taipans,3.28,Adelaide 36ers,1.34,1.051,Sportsbet
Tasmania JackJumpers v Melbourne United,Head To Head,Tasmania JackJumpers,2.04,Melbourne United,1.78,1.052,Sportsbet
Sydney Kings v Illawarra Hawks,Head To Head,Sydney Kings,1.24,Illawarra Hawks,4.1,1.05,Sportsbet
