match,start_time,market_name,home_team,home_win,away_team,away_win,margin,agency
Tasmania JackJumpers v Melbourne United,2025-09-18T09:30:00.000Z,Head To Head,Tasmania JackJumpers,1.85,Melbourne United,1.95,1.053,TAB
New Zealand Breakers v Brisbane Bullets,2025-09-19T07:30:00.000Z,Head To Head,New Zealand Breakers,1.73,Brisbane Bullets,2.1,1.054,TAB
South East Melbourne Phoenix v Cairns Taipans,2025-09-20T07:30:00.000Z,Head To Head,South East Melbourne Phoenix,1.5,Cairns Taipans,2.55,1.059,TAB
Perth Wildcats v Tasmania JackJumpers,2025-09-20T10:00:00.000Z,Head To Head,Perth Wildcats,1.55,Tasmania JackJumpers,2.35,1.071,TAB
Melbourne United v New Zealand Breakers,2025-09-21T04:30:00.000Z,Head To Head,Melbourne United,1.45,New Zealand Breakers,2.65,1.067,TAB
