match,home_team,away_team,start_time,market_name,line,under_price,over_price,margin,agency,market
Tasmania JackJumpers v Brisbane Bullets,Tasmania JackJumpers,Brisbane Bullets,2026-02-06T08:30:00.000Z,Total Points Over/Under,174.5,1.95,1.85,1.053,TAB,Total Match Points
Perth Wildcats v Cairns Taipans,Perth Wildcats,Cairns Taipans,2026-02-06T10:30:00.000Z,Total Points Over/Under,183.5,1.9,1.9,1.053,TAB,Total Match Points
New Zealand Breakers v Illawarra Hawks,New Zealand Breakers,Illawarra Hawks,2026-02-07T06:30:00.000Z,Total Points Over/Under,186.5,1.9,1.9,1.053,TAB,Total Match Points
Melbourne United v Adelaide 36ers,Melbourne United,Adelaide 36ers,2026-02-07T09:00:00.000Z,Total Points Over/Under,183.5,1.9,1.9,1.053,TAB,Total Match Points
South East Melbourne Phoenix v Sydney Kings,South East Melbourne Phoenix,Sydney Kings,2026-02-08T03:30:00.000Z,Total Points Over/Under,193.5,1.9,1.9,1.053,TAB,Total Match Points
