match,start_time,market_name,home_team,home_win,away_team,away_win,margin,agency
Tasmania JackJumpers v Brisbane Bullets,2024-11-15T08:30:00.000Z,Head To Head,Tasmania JackJumpers,1.53,Brisbane Bullets,2.45,1.062,TAB
Perth Wildcats v South East Melbourne Phoenix,2024-11-15T10:30:00.000Z,Head To Head,Perth Wildcats,1.53,South East Melbourne Phoenix,2.45,1.062,TAB
Cairns Taipans v New Zealand Breakers,2024-11-16T06:30:00.000Z,Head To Head,Cairns Taipans,2.45,New Zealand Breakers,1.53,1.062,TAB
Illawarra Hawks v Sydney Kings,2024-11-16T09:00:00.000Z,Head To Head,Illawarra Hawks,2,Sydney Kings,1.8,1.056,TAB
Melbourne United v Adelaide 36ers,2024-11-17T03:30:00.000Z,Head To Head,Melbourne United,1.62,Adelaide 36ers,2.3,1.052,TAB
