match,home_team,away_team,start_time,market_name,line,under_price,over_price,margin,agency,market
Tasmania JackJumpers v Adelaide 36ers,Tasmania JackJumpers,Adelaide 36ers,2025-11-13T08:37:00.000Z,Total Points Over/Under,174.5,2,1.8,1.056,TAB,Total Match Points
Cairns Taipans v South East Melbourne Phoenix,Cairns Taipans,South East Melbourne Phoenix,2025-11-14T08:30:00.000Z,Total Points Over/Under,183.5,1.9,1.9,1.053,TAB,Total Match Points
Melbourne United v Brisbane Bullets,Melbourne United,Brisbane Bullets,2025-11-15T06:30:00.000Z,Total Points Over/Under,184.5,1.9,1.9,1.053,TAB,Total Match Points
Perth Wildcats v New Zealand Breakers,Perth Wildcats,New Zealand Breakers,2025-11-15T09:00:00.000Z,Total Points Over/Under,181.5,1.9,1.9,1.053,TAB,Total Match Points
Illawarra Hawks v Sydney Kings,Illawarra Hawks,Sydney Kings,2025-11-16T03:30:00.000Z,Total Points Over/Under,184.5,1.9,1.9,1.053,TAB,Total Match Points
