match,home_team,away_team,start_time,market_name,line,under_price,over_price,margin,agency,market
Illawarra Hawks v Cairns Taipans,Illawarra Hawks,Cairns Taipans,2025-01-03T08:37:00.000Z,Total Points Over/Under,191.5,1.95,1.85,1.053,TAB,Total Match Points
Adelaide 36ers v Melbourne United,Adelaide 36ers,Melbourne United,2025-01-04T06:30:00.000Z,Total Points Over/Under,198.5,1.9,1.9,1.053,TAB,Total Match Points
Brisbane Bullets v Sydney Kings,Brisbane Bullets,Sydney Kings,2025-01-04T09:00:00.000Z,Total Points Over/Under,191.5,1.9,1.9,1.053,TAB,Total Match Points
New Zealand Breakers v Perth Wildcats,New Zealand Breakers,Perth Wildcats,2025-01-05T03:30:00.000Z,Total Points Over/Under,188.5,1.9,1.9,1.053,TAB,Total Match Points
Tasmania JackJumpers v South East Melbourne Phoenix,Tasmania JackJumpers,South East Melbourne Phoenix,2025-01-05T05:30:00.000Z,Total Points Over/Under,187.5,1.85,1.95,1.053,TAB,Total Match Points
