match,start_time,market_name,home_team,home_win,away_team,away_win,margin,agency
Melbourne United v Tasmania JackJumpers,2024-09-19T20:30:00Z,Head To Head,Melbourne United,1.31,Tasmania JackJumpers,3.25,1.071,TopSport
Perth Wildcats v South East Melbourne Phoenix,2024-09-20T20:30:00Z,Head To Head,Perth Wildcats,1.24,South East Melbourne Phoenix,3.7,1.077,TopSport
New Zealand Breakers v Brisbane Bullets,2024-09-21T18:00:00Z,Head To Head,New Zealand Breakers,1.48,Brisbane Bullets,2.54,1.069,TopSport
Cairns Taipans v Illawarra Hawks,2024-09-21T20:30:00Z,Head To Head,Cairns Taipans,3.15,Illawarra Hawks,1.33,1.069,TopSport
Adelaide 36ers v Sydney Kings,2024-09-22T14:30:00Z,Head To Head,Adelaide 36ers,3.7,Sydney Kings,1.24,1.077,TopSport
